comment,raw_score,length,normalized_score,class
"Pombon<span class=""ytAttributedStringInlineBlockMod"" style=""margin-left: 2px; margin-right: 2px;""><img alt=""❤"" class=""ytCoreImageHost ytAttributedStringImageElement ytAttributedStringImageAlignmentVerticalCenter ytCoreImageContentModeScaleToFill ytCoreImageLoaded"" style=""height: 16px; width: 16px;"" src=""./winds_files/emoji_u2764.png"">",0,1,0.0,neutral
Graphics looks good?,1.0,3,0.3333333333333333,positive
Hopefully a new Eeveelution.,0,4,0.0,neutral
Palworld made them try,0,4,0.0,neutral
This looks great. Finally something that looks like it’s going to be a quality Pokémon game fans have been wanting for years,2.0,22,0.09090909090909091,positive
What region is this?,0,4,0.0,neutral
"Where's squartle,",0,2,0.0,neutral
Dragon type Eevee evolution coming soon?,0,6,0.0,neutral
The Pokémon Center being outside again makes me believe that we still won't be able to go inside buildings. I think I'll skip gen 10 if that's the case.,0,29,0.0,neutral
The next Pokemon game names will be sticks and stones. Mark my words,0,13,0.0,neutral
"Ruby and Sapphire were my absolute favorite games so this feels like coming home! I can't wait, I teared up a little at the little dive under water there at the end...such a well done trailer. Appropriate for a 30th anniversary announcement and game trailer!!!!",2.0,45,0.044444444444444446,positive
"Aah man 2027 gonna take a while<span class=""ytAttributedStringInlineBlockMod"" style=""margin-left: 2px; margin-right: 2px;""><img alt=""🥀"" class=""ytCoreImageHost ytAttributedStringImageElement ytAttributedStringImageAlignmentVerticalCenter ytCoreImageContentModeScaleToFill ytCoreImageLoaded"" style=""height: 16px; width: 16px;"" src=""./winds_files/emoji_u1f940.png"">",0,7,0.0,neutral
"you guys can layer as much bloom as you want on it, it's still a steaming pile.",0,17,0.0,neutral
Please! I'm begging for more fossil pokémon!,0,7,0.0,neutral
"Okay I choose Gequa <span class=""ytAttributedStringInlineBlockMod"" style=""margin-left: 2px; margin-right: 2px;""><img alt=""❤"" class=""ytCoreImageHost ytAttributedStringImageElement ytAttributedStringImageAlignmentVerticalCenter ytCoreImageContentModeScaleToFill ytCoreImageLoaded"" style=""height: 16px; width: 16px;"" src=""./winds_files/emoji_u2764.png"">",0,5,0.0,neutral
looks like this is just 30FPS so sad,1.0,8,0.125,positive
"It looks okay, which is more than you can expect from a Pokémon game in 2026.",0,16,0.0,neutral
I hope the current project will be reconsidered so that one complete game like Pokémon Emerald is released instead of two games.,1.0,22,0.045454545454545456,positive
It's time for pokemon from the endemic animal in Indonesia,0,10,0.0,neutral
Could the new winds legandary Pokémon be a Quetzalcoatl and the new waves legendary Pokémon a sea serpent?,0,18,0.0,neutral
It looks great but i just want a gen 5 remake.,1.0,11,0.09090909090909091,positive
I hope the exp-share is a toggle again,0,8,0.0,neutral
This is a big leap(or should i say dive) from pokemon legends Z-A,0,13,0.0,neutral
"After ash was not there in Pokemon i left watching pokemon because I saw him from my childhood and I can't see a single episode without him <span class=""ytAttributedStringInlineBlockMod"" style=""margin-left: 2px; margin-right: 2px;""><img alt=""😢"" class=""ytCoreImageHost ytAttributedStringImageElement ytAttributedStringImageAlignmentVerticalCenter ytCoreImageContentModeScaleToFill ytCoreImageLoaded"" style=""height: 16px; width: 16px;"" src=""./winds_files/emoji_u1f622.png"">",0,27,0.0,neutral
I have one word to say about this: Pombon,0,9,0.0,neutral
Gecqua is the real MVP tho!,0,6,0.0,neutral
"""we can milk this""",0,4,0.0,neutral
"Actually doesn't look like the bare minimum for once, hope it's solid.",1.0,12,0.08333333333333333,positive
Finally!!! The Caribbean gets its time to shine,0,8,0.0,neutral
"Game freak for the Pokémon wind and waves game in 2027 please make new fossil Dino pokemon based on the stegosaurus, dimetrodon, spinosaurus, ceratosaurus, Coelophysis, velociraptor. Will these fossil pokemon work for you for the 2027 pokemon wind and waves game?<span class=""ytAttributedStringInlineBlockMod"" style=""margin-left: 2px; margin-right: 2px;""><img alt=""❤"" class=""ytCoreImageHost ytAttributedStringImageElement ytAttributedStringImageAlignmentVerticalCenter ytCoreImageContentModeScaleToFill ytCoreImageLoaded"" style=""height: 16px; width: 16px;"" src=""./winds_files/emoji_u2764.png"">",0,41,0.0,neutral
"Close enough, welcome back Alola",0,5,0.0,neutral
Water starter hands down hopefully his evolutions look clean,1.0,9,0.1111111111111111,positive
Polynesia pop off,0,3,0.0,neutral
pombon cry is it barking? peak,1.0,6,0.16666666666666666,positive
"as long as the water and fire starters don't evolve into bipedal evolutions with fire being fighting type again, im willing to give the game a shot",0,27,0.0,neutral
"If the starters final evos (other than the grass starter) end up being bipedal, we riot. We need more quadruped starter evos.",0,22,0.0,neutral
You should make a pokemon game where you get pokeballs and catch your starter instead of crossing yours starter,0,19,0.0,neutral
Do I seriously have to buy a switch 2 for this? Perhaps,0,12,0.0,neutral
"100th Pokémon game with a double release of the same game again <span class=""ytAttributedStringInlineBlockMod"" style=""margin-left: 2px; margin-right: 2px;""><img alt=""😅"" class=""ytCoreImageHost ytAttributedStringImageElement ytAttributedStringImageAlignmentVerticalCenter ytCoreImageContentModeScaleToFill ytCoreImageLoaded"" style=""height: 16px; width: 16px;"" src=""./winds_files/emoji_u1f605.png"">",0,13,0.0,neutral
so what is new outside the obvious?,0,7,0.0,neutral
please alola mapss!!!,0,3,0.0,neutral
"7.8 Out Of 10<span class=""ytAttributedStringInlineBlockMod"" style=""margin-left: 2px; margin-right: 2px;""><img alt=""🗣"" class=""ytCoreImageHost ytAttributedStringImageElement ytAttributedStringImageAlignmentVerticalCenter ytCoreImageContentModeScaleToFill ytCoreImageLoaded"" style=""height: 16px; width: 16px;"" src=""./winds_files/emoji_u1f5e3.png"">",0,4,0.0,neutral
The graphics was never the same after sword and shield.,0,10,0.0,neutral
"What's up Palworld peeps, oops wrong channel <span class=""ytAttributedStringInlineBlockMod"" style=""margin-left: 2px; margin-right: 2px;""><img alt=""😬"" class=""ytCoreImageHost ytAttributedStringImageElement ytAttributedStringImageAlignmentVerticalCenter ytCoreImageContentModeScaleToFill ytCoreImageLoaded"" style=""height: 16px; width: 16px;"" src=""./winds_files/emoji_u1f62c.png"">",-1.0,8,-0.125,negative
WW3 is pretty bad... atleast we get to see Pikachu in 4k.,-1.0,12,-0.08333333333333333,negative
They couldn’t take you to Brazil so they created Pokémon Brazil,0,11,0.0,neutral
"Like Pokemon Sword and Pokemon Shield, discover epic wonders in the sky and water. Surprised to find that Game Freak is partners with The Pokemon Company like Marza Animation Planet and Blur Studio are partners with Sega Corporation.",1.5,38,0.039473684210526314,positive
I didn't even know what new Pokemon game was being developed. Ever since Scarlett and violet are kind of been out of the loop and I wasn't even able to play the XYZ game that came out recently,0,38,0.0,neutral
"Congratulations on the 30th anniversary of Pokémon!Do you plan to reopen some previous Mystery Gift events? Such as those for Pokémon Brilliant Diamond and Shining Pearl, Pokémon Sword and Shield, and Pokémon Scarlet and Violet.",0,35,0.0,neutral
Why haven't there been fossil legends or pseudo legendaries besides Genesect,0,11,0.0,neutral
This really makes me want a alola remake,0,8,0.0,neutral
What kind of starters are those wtf lol,0,8,0.0,neutral
"Where's suirtle <span class=""ytAttributedStringInlineBlockMod"" style=""margin-left: 2px; margin-right: 2px;""><img alt=""🥺"" class=""ytCoreImageHost ytAttributedStringImageElement ytAttributedStringImageAlignmentVerticalCenter ytCoreImageContentModeScaleToFill ytCoreImageLoaded"" style=""height: 16px; width: 16px;"" src=""./winds_files/emoji_u1f97a.png"">",0,3,0.0,neutral
At first I was very worried this might be ZA all over again with no new info for a year but after going through that at least we know what to expect. Hopefully if it’s an early to mid 2027 release we may possibly get new info throughout the year but I won’t hold my breath to that. Still very exciting,-1.0,61,-0.01639344262295082,negative
Wow . I like new gen 10 ! My favourite starter is pombon ! But what is you  favourite starter ?,1.0,21,0.047619047619047616,positive
This reveal trailer almost having half as many views as scarlet and violets reveal trailer in 4 years should tell everybody: HYPE IS BACK!,1.0,24,0.041666666666666664,positive
They killed the Pokemon series long time ago,0,8,0.0,neutral
"If we can’t sail in the games and respectably merge the two elements, I’m going to see it as a lost opportunity",0,22,0.0,neutral
This is like temu hoen too much water,1.0,8,0.125,positive
"Next year <span class=""ytAttributedStringInlineBlockMod"" style=""margin-left: 2px; margin-right: 2px;""><img alt=""😂"" class=""ytCoreImageHost ytAttributedStringImageElement ytAttributedStringImageAlignmentVerticalCenter ytCoreImageContentModeScaleToFill ytCoreImageLoaded"" style=""height: 16px; width: 16px;"" src=""./winds_files/emoji_u1f602.png"">",0,3,0.0,neutral
"It looks like GX <span class=""ytAttributedStringInlineBlockMod"" style=""margin-left: 2px; margin-right: 2px;""><img alt=""❓"" class=""ytCoreImageHost ytAttributedStringImageElement ytAttributedStringImageAlignmentVerticalCenter ytCoreImageContentModeScaleToFill ytCoreImageLoaded"" style=""height: 16px; width: 16px;"" src=""./winds_files/emoji_u2753.png"">",1.0,5,0.2,positive
they better give lokix some better cards,0,7,0.0,neutral
"If this one has a full voice acting, it would be perfect.",1.0,12,0.08333333333333333,positive
"Pokemon Wuthering Waves <span class=""ytAttributedStringInlineBlockMod"" style=""margin-left: 2px; margin-right: 2px;""><img alt=""😂"" class=""ytCoreImageHost ytAttributedStringImageElement ytAttributedStringImageAlignmentVerticalCenter ytCoreImageContentModeScaleToFill ytCoreImageLoaded"" style=""height: 16px; width: 16px;"" src=""./winds_files/emoji_u1f602.png"">",0,4,0.0,neutral
Hope you either got a switch 2 or enough money for one along with a spare 80$ because gen 10 is right around the corner.,0,25,0.0,neutral
I’ll be getting the switch 2 just for this just like I got the switch original for sword and shield don’t let us down guys please nothing like scarlet and violets engine please or graphics or bugs please god,0.5,39,0.01282051282051282,positive
"i hope this can go toe to toe with world building &amp; music in pokemon ultra sun/ultra moon &amp; sword/shield.. <span class="""" dir=""auto"" style=""font-weight: 500;"">and not focusing on detailed toes which aren't visible..",0,28,0.0,neutral
"POWER*(Attack/Defense) is part of the formula where damage is calculated. Well, how can we calculate the damage and why these Attacks and Defenses, if we can't see the Attack and defense of the enemies (opponents). Why was it necessary to hide it?",0,42,0.0,neutral
pikachuu,0,1,0.0,neutral
Not forget language Portuguese,0,3,0.0,neutral
Grass/fight - fire/electric - water/ dragon,0,6,0.0,neutral
looks good for 2013,1.0,4,0.25,positive
Pokemon Salt and Vinegar,0,4,0.0,neutral
So the rumors were right it is winds and waves,0,10,0.0,neutral
"2027<span class=""ytAttributedStringInlineBlockMod"" style=""margin-left: 2px; margin-right: 2px;""><img alt=""🤯"" class=""ytCoreImageHost ytAttributedStringImageElement ytAttributedStringImageAlignmentVerticalCenter ytCoreImageContentModeScaleToFill ytCoreImageLoaded"" style=""height: 16px; width: 16px;"" src=""./winds_files/emoji_u1f92f.png"">",0,1,0.0,neutral
"I actually appreciate you guys at the Pokemon Company taking your time with these mainline games cause that's how everything in the video game industry follows the same as in the art industry and the toy making industry, taking your time and not rushing things. I don't normally choose my starter till I see at least it's final stage but we haven't had a trailer that revealed starter evolutions since Sun and Moon but I'm already on team Gecqua. However, I would like to see my boy Skitty return in a brand new game like this one and not in a remake for once. We haven't seen Skitty in a brand new mainline game since Sun and Moon and I'm tired of seeing Purrloin, bring Skitty back and I'll buy both copies soon as I can when the game hits store shelves",0.5,140,0.0035714285714285713,positive
"I hope Wailord gets something new, it’s my favorite!",1.0,9,0.1111111111111111,positive
wow they actually made a pokemon game for the switch that doesnt look like ps2 graphics,1.0,16,0.0625,positive
"What we see in the sky, this Pokemon-shaped cloud, is definitely not a coincidence. I'm betting it's a legendary of one of the versions. I'm betting on Waves. It resembles a Chinese dragon, a Flying/Dragon type. If I work on it, it could be one of the more interesting legendaries. I'm also curious about the second legend. I'm betting on a water-related Pokemon, maybe a Water/Dragon type, or some kind of sea monster. What do you think? I'm waiting for the trailer with the legendaries,which version I choose depends on which of the legends is more interesting and my starter is Pombon:)",0,101,0.0,neutral
SAD ITS not for nintendo switch only for nintendo switch 2,0,10,0.0,neutral
"This Gen doesn’t feel as hyped as to when Alola was revealed. The trailer alone I remember got 5m views during the same year 2016 and Gen 10 only stuck on 2M <span class=""ytAttributedStringInlineBlockMod"" style=""margin-left: 2px; margin-right: 2px;""><img alt=""💔"" class=""ytCoreImageHost ytAttributedStringImageElement ytAttributedStringImageAlignmentVerticalCenter ytCoreImageContentModeScaleToFill ytCoreImageLoaded"" style=""height: 16px; width: 16px;"" src=""./winds_files/emoji_u1f494.png"">",0,33,0.0,neutral
People who have eshop cards but no switch 2:,-1.0,9,-0.1111111111111111,negative
Guys I’m confident we can beat atlético but I don’t think we can overturn the result especially without conceding a goal. Either way if we get knocked out let’s not overreact the copa is the second least important comp we play after the super copa,0,44,0.0,neutral
Usually I'm team keep all their feet on the ground!BUTHear me outPompon....GREATER DOGFire steel.,0,14,0.0,neutral
0/10-WAY TOO MUCH WATER,0,4,0.0,neutral
I love all of the complaining in the comments. You know everyone complaining is still gonna buy it XD,1.0,19,0.05263157894736842,positive
Worst starter design,0,3,0.0,neutral
Please please please don’t suck,-1.0,5,-0.2,negative
"Ash back<span class=""ytAttributedStringInlineBlockMod"" style=""margin-left: 2px; margin-right: 2px;""><img alt=""😢"" class=""ytCoreImageHost ytAttributedStringImageElement ytAttributedStringImageAlignmentVerticalCenter ytCoreImageContentModeScaleToFill ytCoreImageLoaded"" style=""height: 16px; width: 16px;"" src=""./winds_files/emoji_u1f622.png"">",0,2,0.0,neutral
"Welp, we already know what starter Lily-""Pomeranian-Lover""-Pichu is going to choose if she buys this game lol",0,17,0.0,neutral
"Promising yet skeptical trailers have no value these days &amp; I’m not willing to take the risk but let’s see how this one goes, I’m hoping it’s an upgrade from arceus cus that game was definitely worth it &amp; they were in their bag w that one.",-1.0,46,-0.021739130434782608,negative
I just want an option to turn off EXP share. Please.,0,11,0.0,neutral
"For Pokémon wind and waves fossils Create a Rock/ Dragon- StegosaurusWater/ rock- spinosaurusRock/ ice- spinosaurusRock/ fighting velociraptorFor Pokémon wind and waves in 2027 sound good to you? Do you like these new dinosaur fossil pokemon for wind  and waves and will you please create them and use them<span class=""ytAttributedStringInlineBlockMod"" style=""margin-left: 2px; margin-right: 2px;""><img alt=""❤"" class=""ytCoreImageHost ytAttributedStringImageElement ytAttributedStringImageAlignmentVerticalCenter ytCoreImageContentModeScaleToFill"" style=""height: 16px; width: 16px;"">",2.0,48,0.041666666666666664,positive
"Please, Pokémon Company, make all of Pombon's evolutions quadrupedal, something more animalistic and guardian-like.",0,14,0.0,neutral
Make an alolan game with such graphics,0,7,0.0,neutral
"ngl, these name would've fit Pokemon Gold and Silver, since Ho-oh would represent Winds and Lugia would represent Waves...",0,19,0.0,neutral
This animation had a higher budget than Scarlet and Violet,0,10,0.0,neutral
Must’ve been the Winds…,0,4,0.0,neutral
"please let us crack our Pokemon in this game <span class=""ytAttributedStringInlineBlockMod"" style=""margin-left: 2px; margin-right: 2px;""><img alt=""🙏"" class=""ytCoreImageHost ytAttributedStringImageElement ytAttributedStringImageAlignmentVerticalCenter ytCoreImageContentModeScaleToFill ytCoreImageLoaded"" style=""height: 16px; width: 16px;"" src=""./winds_files/emoji_u1f64f.png"">",0,10,0.0,neutral
Literrally feng shui,0,3,0.0,neutral
Can't wait for the legendaries to fight each other like kyogre and groudon,1.0,13,0.07692307692307693,positive
pls make competitive pokemon more strategic and defensive &lt;3 like in champions,0.0,12,0.0,neutral
Is it only available for switch 2?,0,7,0.0,neutral
It give me alolah vibe,0,5,0.0,neutral
"I know I used treecko and turtwig.. but this is different, actually liked the grass starter for real for real this time not eyeing the fire this is good",1.0,28,0.03571428571428571,positive
Remarkable! This brings back to the Pokemon orange island league! Brock leaves to work with Professor Oak and a new character Tracy arrives,0,23,0.0,neutral
I guess they put all there resources into just water and now the forest is gonna suck LOL,-1.0,18,-0.05555555555555555,negative
I hope they actually put a small fraction of the money they make into the game to make something exciting and epic,2.0,22,0.09090909090909091,positive
Hopefully the Switch 2 OLED is out by the time this releases.,0,12,0.0,neutral
the Scarif region,0,3,0.0,neutral
"So the starters this time are another grass bird, another fire mammal, and another water reptile/amphibian... are the fire starter and water starter at least gonna stay on all four feet this time? XD",0,34,0.0,neutral
"Even tho i agree S/V has perfomance issues and its art design isnt that good apart from some places, i think its an A tier game... the story is one of the best stories in the pokemon franchise, the regions are cool, the pokedex is great, there are battles that are really hard/competitive, and Area Zero was so cool especially the soundtrack (with the help of THE Toby Fox), it also has many things to do + the dlc wasnt even that bad (apart from the new ""legendaries"" lol). I really liked it, and for me it was the best pokemon game since xy for sure (didnt play SM and USUM sorry guys).Now that the devs got 4 years to do the new Winds &amp; Waves im hoping its actually gonna be peak since the last time they took 4 years to make a new gen it was gen 5, that had B2/W2 one of my favourite pokemon games behind only to HG/SS and Platinum.",3.0,165,0.01818181818181818,positive
"Roy's Rotom Phone: ""Pombon, the Puppy Pokémon. A Fire type. Inside Pombon's lungs is an organ that generates heat, which causes the red area on its chest to glow slightly. Pombon is described to have an innocent, friendly temperament.""Roy: ""Hey, Pombon, wanna join me, Skeledirge and Kilowattrel on our journey to catch the Black Rayquaza?""Pombon: ""Pom, pom!""",0,57,0.0,neutral
Pokémon:Trees and branches Fruits and vegetables Republican and democratBarcelona and Madrid,0,11,0.0,neutral
"dang i thought that was some of the game footage in the start and was surprised with the graphics""not the actual game footage"" <span class=""ytAttributedStringInlineBlockMod"" style=""margin-left: 2px; margin-right: 2px;""><img alt=""🤡"" class=""ytCoreImageHost ytAttributedStringImageElement ytAttributedStringImageAlignmentVerticalCenter ytCoreImageContentModeScaleToFill ytCoreImageLoaded"" style=""height: 16px; width: 16px;"" src=""./winds_files/emoji_u1f921.png"">",-1.0,23,-0.043478260869565216,negative
Bring back ashh to wonds and waves please,0,8,0.0,neutral
nintendo should named the new pokemon series as MBG island representative of indonesia policy,0,14,0.0,neutral
my starter is 100% gonna be the toby fox dog,0,10,0.0,neutral
"This trailer will go down in history as one of the best pokemon game first trailers. I've watched it so many times I'm so excited <span class=""ytAttributedStringInlineBlockMod"" style=""margin-left: 2px; margin-right: 2px;""><img alt=""😭"" class=""ytCoreImageHost ytAttributedStringImageElement ytAttributedStringImageAlignmentVerticalCenter ytCoreImageContentModeScaleToFill ytCoreImageLoaded"" style=""height: 16px; width: 16px;"" src=""./winds_files/emoji_u1f62d.png"">",1.0,26,0.038461538461538464,positive
"The fact yall making me buy a switch 2 <span class=""ytAttributedStringInlineBlockMod"" style=""margin-left: 2px; margin-right: 2px;""><img alt=""😭"" class=""ytCoreImageHost ytAttributedStringImageElement ytAttributedStringImageAlignmentVerticalCenter ytCoreImageContentModeScaleToFill ytCoreImageLoaded"" style=""height: 16px; width: 16px;"" src=""./winds_files/emoji_u1f62d.png"">",0,10,0.0,neutral
Aren’t we running in circles with the starters that this point?,0,11,0.0,neutral
i bet this will release in fall 2027,0,8,0.0,neutral
Ok I don't know about those starters kind of disappointed,0,10,0.0,neutral
lol,0,1,0.0,neutral
"How do you think this time there will be Black&amp;White remakes? Like ""Night black"" ""Day White"" ?",1.0,17,0.058823529411764705,positive
"Only for the switch 2 ???Well, I’m chopped <span class=""ytAttributedStringInlineBlockMod"" style=""margin-left: 2px; margin-right: 2px;""><img alt=""😭"" class=""ytCoreImageHost ytAttributedStringImageElement ytAttributedStringImageAlignmentVerticalCenter ytCoreImageContentModeScaleToFill ytCoreImageLoaded"" style=""height: 16px; width: 16px;"" src=""./winds_files/emoji_u1f62d.png"">",0,9,0.0,neutral
Finaly thank got it's not like scarlet and violet,0,8,0.0,neutral
after pokemon z-a i don’t know will i buy this game.,0,11,0.0,neutral
"It's a kind of motivation for me to buy this after 1 year<span class=""ytAttributedStringInlineBlockMod"" style=""margin-left: 2px; margin-right: 2px;""><img alt=""😢"" class=""ytCoreImageHost ytAttributedStringImageElement ytAttributedStringImageAlignmentVerticalCenter ytCoreImageContentModeScaleToFill ytCoreImageLoaded"" style=""height: 16px; width: 16px;"" src=""./winds_files/emoji_u1f622.png"">",0,13,0.0,neutral
Will it be available for switch 1?,0,7,0.0,neutral
SAWIIIIIIIIIIITTTTTTTTTTTTTTTTT!!!!!!!!!!!!!,0,1,0.0,neutral
Can I play this on my switch or do I have the get the 2?,0,15,0.0,neutral
I. Want. The. Dog,0,4,0.0,neutral
I mean at least they've upgraded from ps1 graphics to ps3,0,11,0.0,neutral
"Why 2027<span class=""ytAttributedStringInlineBlockMod"" style=""margin-left: 2px; margin-right: 2px;""><img alt=""😭"" class=""ytCoreImageHost ytAttributedStringImageElement ytAttributedStringImageAlignmentVerticalCenter ytCoreImageContentModeScaleToFill ytCoreImageLoaded"" style=""height: 16px; width: 16px;"" src=""./winds_files/emoji_u1f62d.png"">",0,2,0.0,neutral
Don’t even joke lad.,0,4,0.0,neutral
"Their making more pokemon games who they trying to compete with Fortnight ? COD? <span class=""ytAttributedStringInlineBlockMod"" style=""margin-left: 2px; margin-right: 2px;""><img alt=""😂"" class=""ytCoreImageHost ytAttributedStringImageElement ytAttributedStringImageAlignmentVerticalCenter ytCoreImageContentModeScaleToFill ytCoreImageLoaded"" style=""height: 16px; width: 16px;"" src=""./winds_files/emoji_u1f602.png"">",-1.0,15,-0.06666666666666667,negative
Are they even putting efforts into Pokemon designs anymore?,0,9,0.0,neutral
WAY too much water 5/10,0,5,0.0,neutral
"Thanks Po Go <span class=""ytAttributedStringInlineBlockMod"" style=""margin-left: 2px; margin-right: 2px;""><img alt=""❤"" class=""ytCoreImageHost ytAttributedStringImageElement ytAttributedStringImageAlignmentVerticalCenter ytCoreImageContentModeScaleToFill ytCoreImageLoaded"" style=""height: 16px; width: 16px;"" src=""./winds_files/emoji_u2764.png"">",0,4,0.0,neutral
Looks like a knock off of palworld,1.0,7,0.14285714285714285,positive
"Those clouds were fighting for their lives to try and render <span class=""ytAttributedStringInlineBlockMod"" style=""margin-left: 2px; margin-right: 2px;""><img alt=""😭"" class=""ytCoreImageHost ytAttributedStringImageElement ytAttributedStringImageAlignmentVerticalCenter ytCoreImageContentModeScaleToFill ytCoreImageLoaded"" style=""height: 16px; width: 16px;"" src=""./winds_files/emoji_u1f62d.png"">",0,12,0.0,neutral
