comment,raw_score,length,normalized_score,class
Actual Pokemon games getting closer and closer to pokepark every generation.,0,11,0.0,neutral
Ok I think it actually looks nice! And the starters are cute too. Wow!,1.0,14,0.07142857142857142,positive
"Finally, a Pokémon game with graphics!",0,6,0.0,neutral
I think it’s just coral,0,5,0.0,neutral
Something tell me pombon gonna evolve into one of them ones,0,11,0.0,neutral
browt looks tuff lowk,0,4,0.0,neutral
I’m not too keen on the starter designs but this actually looks really good. I’m looking forward to more info on this.,1.0,21,0.047619047619047616,positive
"What is that resolution man...<span class=""ytAttributedStringInlineBlockMod"" style=""margin-left: 2px; margin-right: 2px;""><img alt=""💀"" class=""ytCoreImageHost ytAttributedStringImageElement ytAttributedStringImageAlignmentVerticalCenter ytCoreImageContentModeScaleToFill ytCoreImageLoaded"" style=""height: 16px; width: 16px;"" src=""./winds_files/emoji_u1f480.png"">",0,5,0.0,neutral
I cant wait to enter buildings now,0,7,0.0,neutral
"Unova and Johto 3D remakes please <span class=""ytAttributedStringInlineBlockMod"" style=""margin-left: 2px; margin-right: 2px;""><img alt=""🥺"" class=""ytCoreImageHost ytAttributedStringImageElement ytAttributedStringImageAlignmentVerticalCenter ytCoreImageContentModeScaleToFill ytCoreImageLoaded"" style=""height: 16px; width: 16px;"" src=""./winds_files/emoji_u1f97a.png"">",0,7,0.0,neutral
cant wait to explore a world of emptiness,0,8,0.0,neutral
how bout some Pokémon snap added to this omg,0,9,0.0,neutral
low key this game it gana be soooo good i cant stop whaching the trailer,1.0,15,0.06666666666666667,positive
i gotta catch em all the problem is i do not have nintendo 2,0,13,0.0,neutral
It's like pokemon snap,1.0,4,0.25,positive
another vacant 2004 era looking pokemon game.,0,7,0.0,neutral
"If this game sells badly the next in the series might actually be up to standard!!!<span class=""ytAttributedStringInlineBlockMod"" style=""margin-left: 2px; margin-right: 2px;""><img alt=""😮"" class=""ytCoreImageHost ytAttributedStringImageElement ytAttributedStringImageAlignmentVerticalCenter ytCoreImageContentModeScaleToFill ytCoreImageLoaded"" style=""height: 16px; width: 16px;"" src=""./winds_files/emoji_u1f62e.png"">",0,16,0.0,neutral
"Sorry I’m late but this will be fire<span class=""ytAttributedStringInlineBlockMod"" style=""margin-left: 2px; margin-right: 2px;""><img alt=""🔥"" class=""ytCoreImageHost ytAttributedStringImageElement ytAttributedStringImageAlignmentVerticalCenter ytCoreImageContentModeScaleToFill ytCoreImageLoaded"" style=""height: 16px; width: 16px;"" src=""./winds_files/emoji_u1f525.png"">",0,8,0.0,neutral
A Flying type Eevee evolution would make a lot of sense in Pokemon Winds,0,14,0.0,neutral
I'm Gonna Love This Aren't I,1.0,6,0.16666666666666666,positive
THEY BROUGHT MAI BOINBACK (wailord),0,5,0.0,neutral
It actually looks okay,0,4,0.0,neutral
"We got a cat turn bi-pedal, now we’ll get a dog to be bi-pedal as well.",0,16,0.0,neutral
Looks like im getting a switch 2,1.0,7,0.14285714285714285,positive
They really are flexing that windmill fps there lmao,0,9,0.0,neutral
OMG,0,1,0.0,neutral
"We're moving onto PS3 graphics ?! Crazy <span class=""ytAttributedStringInlineBlockMod"" style=""margin-left: 2px; margin-right: 2px;""><img alt=""🎉"" class=""ytCoreImageHost ytAttributedStringImageElement ytAttributedStringImageAlignmentVerticalCenter ytCoreImageContentModeScaleToFill ytCoreImageLoaded"" style=""height: 16px; width: 16px;"" src=""./winds_files/emoji_u1f389.png"">",0,8,0.0,neutral
hope that pombon stayed 4 legged,0,6,0.0,neutral
are you guys going to attempt to patent anything else this time around?,0,13,0.0,neutral
So pokemon winds and waves is southeast Asia. Wow,0,9,0.0,neutral
i swear brouts gonna evolve into a samurai/ninja themed pokemon,0,10,0.0,neutral
They sure like their water,1.0,5,0.2,positive
Growlithe better be available,0,4,0.0,neutral
GUYS THE REAL GEN 10 IS COMING SOON,0,8,0.0,neutral
Battle form of picachu its Perfect,1.0,6,0.16666666666666666,positive
"guys, play the diving part with any hoen dive or unova marine tube remix and it feels like childhood crying in excitment from the bottom of yall hearts",1.0,28,0.03571428571428571,positive
"Toby Fox doing music wasn’t enough, now he’s a starter too",0,11,0.0,neutral
I hope you can go inside a lot of buildings last games the town felt boring and lifeless in S and V.,-1.0,22,-0.045454545454545456,negative
"It looks so flipping realistic <span class=""ytAttributedStringInlineBlockMod"" style=""margin-left: 2px; margin-right: 2px;""><img alt=""🤯"" class=""ytCoreImageHost ytAttributedStringImageElement ytAttributedStringImageAlignmentVerticalCenter ytCoreImageContentModeScaleToFill ytCoreImageLoaded"" style=""height: 16px; width: 16px;"" src=""./winds_files/emoji_u1f92f.png"">",0,6,0.0,neutral
I wonder what gimmick we will have,0,7,0.0,neutral
"I know nobody will see thud, but I just wanted to say, I love how at the end they leave you with just the sounds of the titles, the squall of winds above craxsging waves. Such a calm, thematic way to end the direct.",1.0,44,0.022727272727272728,positive
I wish browt evolves into terrence,0,6,0.0,neutral
"<span class=""ytAttributedStringInlineBlockMod"" style=""margin-left: 2px; margin-right: 2px;""><img alt=""😀"" class=""ytCoreImageHost ytAttributedStringImageElement ytAttributedStringImageAlignmentVerticalCenter ytCoreImageContentModeScaleToFill ytCoreImageLoaded"" style=""height: 16px; width: 16px;"" src=""./winds_files/emoji_u1f600.png"">",0,1,0.0,neutral
This might be based off in the Philippines I can tell,0,11,0.0,neutral
Cant wait to see the dunkey vid,0,7,0.0,neutral
BACKYARD BASEBALL NOW THIS,0,4,0.0,neutral
Pikachu has fur in the game now. Yay!,0,8,0.0,neutral
Pokemon Sawit and Pokemon Banjir is real,0,7,0.0,neutral
....imma wait n see streams first and if the graphics are accurate i might get it and a S2,0,19,0.0,neutral
pleace add any voices from mouth of these characters whenthey spoke xd,0,12,0.0,neutral
Am I the only one that prefered when Pokémon wasn't open world?,0,12,0.0,neutral
Wonder what the shinies look like?,1.0,6,0.16666666666666666,positive
"Ada indonesia coy<span class=""ytAttributedStringInlineBlockMod"" style=""margin-left: 2px; margin-right: 2px;""><img alt=""😱"" class=""ytCoreImageHost ytAttributedStringImageElement ytAttributedStringImageAlignmentVerticalCenter ytCoreImageContentModeScaleToFill ytCoreImageLoaded"" style=""height: 16px; width: 16px;"" src=""./winds_files/emoji_u1f631.png"">",0,3,0.0,neutral
Why do i feel like lugia an Raquazia are gonna be here.,1.0,12,0.08333333333333333,positive
Missed opportunity to name it Pokemon Windwaver,0,7,0.0,neutral
"Huh, it’s like Rufflet and Rowlet had an egg and somehow hatched out a hybrid",1.0,15,0.06666666666666667,positive
I like BombPom as a name. His tail to me reminds me of a lit match/fuse to an explosive.,1.0,19,0.05263157894736842,positive
"WHAT IF GRAVITY FALLS AS POKEMON TRAINERS!?<span class=""ytAttributedStringInlineBlockMod"" style=""margin-left: 2px; margin-right: 2px;""><img alt=""😂"" class=""ytCoreImageHost ytAttributedStringImageElement ytAttributedStringImageAlignmentVerticalCenter ytCoreImageContentModeScaleToFill ytCoreImageLoaded"" style=""height: 16px; width: 16px;"" src=""./winds_files/emoji_u1f602.png"">",0,7,0.0,neutral
I looks good! and i recently got a switch... but now i need a Switch 2 for this...noooooooo. why. T.T,1.0,20,0.05,positive
Am choosing Browt for my starter Pokémon and I going with winds because seeing the green and green is my favorite color,1.0,22,0.045454545454545456,positive
I'm skeptical,0,2,0.0,neutral
Did anybody see any new Pokemon other than the starters?,0,10,0.0,neutral
Weird we didn’t get a region name,0,7,0.0,neutral
"Well…we will “sea” <span class=""ytAttributedStringInlineBlockMod"" style=""margin-left: 2px; margin-right: 2px;""><img alt=""👀"" class=""ytCoreImageHost ytAttributedStringImageElement ytAttributedStringImageAlignmentVerticalCenter ytCoreImageContentModeScaleToFill ytCoreImageLoaded"" style=""height: 16px; width: 16px;"" src=""./winds_files/emoji_u1f440.png"">",0,4,0.0,neutral
Yoo one gerat idea would be combining all gens into one game and going the way the anime showed it that would be sickkkkkkkkkk,0,24,0.0,neutral
"i'm so ready to have a 7.9/10 time, who else is?",0,11,0.0,neutral
"Also, could be the live-action intro could be a reference to the return of Ash and Pikachu?",0,17,0.0,neutral
if you guys make pombons final evolution look like solgaloe ill do anything,1.0,13,0.07692307692307693,positive
"Os iniciais novos parecem aqueles Pokémons feitos por fãs, Fakemons",0,10,0.0,neutral
POKEMON. PUT MELMETAL IN THIS GAME AND GIVE ME MORE LORE AND MY LIFE IS YOURS,0,16,0.0,neutral
plz tell me we can jump in this game!,0,9,0.0,neutral
finally a good looking pokemon... they discover vivid colors,1.0,9,0.1111111111111111,positive
"Now, i can't wait in June for the official announcement <span class=""ytAttributedStringInlineBlockMod"" style=""margin-left: 2px; margin-right: 2px;""><img alt=""🔥"" class=""ytCoreImageHost ytAttributedStringImageElement ytAttributedStringImageAlignmentVerticalCenter ytCoreImageContentModeScaleToFill ytCoreImageLoaded"" style=""height: 16px; width: 16px;"" src=""./winds_files/emoji_u1f525.png"">",0,11,0.0,neutral
So considering the leaks boy this is gonna be more like if sinnoh and alola have a baby.,1.0,18,0.05555555555555555,positive
I am watching this trailer daily. I think I might have a problem.,0,13,0.0,neutral
Catching up to 2007 crisis i see,0,7,0.0,neutral
So this should also be on nitendo switch 1. (maybe),0,10,0.0,neutral
The wailords look too small,0,5,0.0,neutral
"If this is exclusively switch 2 I hope this tanks so I can get it <span class=""ytAttributedStringInlineBlockMod"" style=""margin-left: 2px; margin-right: 2px;""><img alt=""😭"" class=""ytCoreImageHost ytAttributedStringImageElement ytAttributedStringImageAlignmentVerticalCenter ytCoreImageContentModeScaleToFill ytCoreImageLoaded"" style=""height: 16px; width: 16px;"" src=""./winds_files/emoji_u1f62d.png"">",0,16,0.0,neutral
ALOALA?!?,0,1,0.0,neutral
i cant wait for pokemon apples and oranges,0,8,0.0,neutral
Dang… already?,0,2,0.0,neutral
"I wonder if Blastoise can display water blasts being fired from its cannon muzzles. Or, just summons anyways",0,18,0.0,neutral
i love browt,1.0,3,0.3333333333333333,positive
Pombon will evolve into Spitzflame and then into Samoyebon/Plasmoyed.,0,9,0.0,neutral
cant wait for it to only have 200 pokemon in it,0,11,0.0,neutral
They should release a Pokémon MMO/MMORPG,0,6,0.0,neutral
The drawings made me think it was gonna be something different,0,11,0.0,neutral
"First Toby Fox composed for Pokemon SWSH, and now he's in the game?? Congrats Toby <span class=""ytAttributedStringInlineBlockMod"" style=""margin-left: 2px; margin-right: 2px;""><img alt=""👏🏻"" class=""ytCoreImageHost ytAttributedStringImageElement ytAttributedStringImageAlignmentVerticalCenter ytCoreImageContentModeScaleToFill ytCoreImageLoaded"" style=""height: 16px; width: 16px;"" src=""./winds_files/emoji_u1f44f_1f3fb.png"">",0,16,0.0,neutral
"Finally, Pokemon for the PS4.",0,5,0.0,neutral
I hope they make a new version of Goldeen,0,9,0.0,neutral
wait was the grass starter just rowlet????,0,7,0.0,neutral
Personally I think the water would have been color if they chose the legend of Zelda windwaker style,0,18,0.0,neutral
it's going to be a game-key card. i'm calling it.,0,10,0.0,neutral
I liked everything except the starters.,0,6,0.0,neutral
Water cat starter when?,0,4,0.0,neutral
I think. Wave will be most people’s choice but I want to play wind with the grass bird starter,0,19,0.0,neutral
"The game is like full of water! fullll of water!!<span class=""ytAttributedStringInlineBlockMod"" style=""margin-left: 2px; margin-right: 2px;""><img alt=""👇"" class=""ytCoreImageHost ytAttributedStringImageElement ytAttributedStringImageAlignmentVerticalCenter ytCoreImageContentModeScaleToFill ytCoreImageLoaded"" style=""height: 16px; width: 16px;"" src=""./winds_files/emoji_u1f447.png"">",1.0,10,0.1,positive
How will they disappoint this time?,-1.0,6,-0.16666666666666666,negative
also ich bin irgendwie hyped,0,5,0.0,neutral
"Of course there must be new legendary Pokemon, like who's the wind pokemon and the wave pokemon?",1.0,17,0.058823529411764705,positive
"I choose Browt! Because its my childhood Angry Birds! <span class=""ytAttributedStringInlineBlockMod"" style=""margin-left: 2px; margin-right: 2px;""><img alt=""❤"" class=""ytCoreImageHost ytAttributedStringImageElement ytAttributedStringImageAlignmentVerticalCenter ytCoreImageContentModeScaleToFill ytCoreImageLoaded"" style=""height: 16px; width: 16px;"" src=""./winds_files/emoji_u2764.png"">",0,10,0.0,neutral
..I’m still taking the fire type,0,6,0.0,neutral
"<span class=""ytAttributedStringInlineBlockMod"" style=""margin-left: 2px; margin-right: 2px;""><img alt=""👍"" class=""ytCoreImageHost ytAttributedStringImageElement ytAttributedStringImageAlignmentVerticalCenter ytCoreImageContentModeScaleToFill ytCoreImageLoaded"" style=""height: 16px; width: 16px;"" src=""./winds_files/emoji_u1f44d.png"">",0,1,0.0,neutral
I wonder how laggy this one will be. Maybe we objects can render more than 15 yards away on Switch 2?,0,21,0.0,neutral
Cant wait. Please have charizard and Chimchar,0,7,0.0,neutral
"If there’s no subscription so you can hold more pokemon in this game I may finally be able to play a pokemon game again! When they added a paywall for the Pokemon it was like a slap in the face from Nintendo so I stopped playing pokemon til they removed it and now ,hopefully, I can enjoy a video game where you only need to pay once to play",-3.0,69,-0.043478260869565216,negative
"Hopefully Winds &amp; Waves has startup selection options for those with warm brown skin tones and afro-texture curls, the personalised experience should be universally representative.",0,25,0.0,neutral
Pokemon HM dive and HM fly,0,6,0.0,neutral
"Much better than horizon <span class=""ytAttributedStringInlineBlockMod"" style=""margin-left: 2px; margin-right: 2px;""><img alt=""😊"" class=""ytCoreImageHost ytAttributedStringImageElement ytAttributedStringImageAlignmentVerticalCenter ytCoreImageContentModeScaleToFill ytCoreImageLoaded"" style=""height: 16px; width: 16px;"" src=""./winds_files/emoji_u1f60a.png"">",0,5,0.0,neutral
The precures are the gym leaders,0,6,0.0,neutral
i hope for a serious team aqua return,0,8,0.0,neutral
Did Rare help out with this? The water and clouds look so much like those of Sea of Thieves.,1.0,19,0.05263157894736842,positive
Pokemon rules.,0,2,0.0,neutral
I just got back into Scarlet and was about to get the DLC then this shows up on my algorithm. Damn it’s like I felt it in my bones they were gonna update this after all the Pokopia and ZA hype,2.0,41,0.04878048780487805,positive
I can finally breathe. We got the game we've always wanted. Thank you Gamefreak!!!,0,14,0.0,neutral
"This actually looks good! Not just by Pokemon game standards either, but also from a gaming point of view.",1.0,18,0.05555555555555555,positive
wish theyd blend the game with the older style more. open world is cool but miss how the older games were too. but looks good compared to games like Z and A/ Scarlett for sure.,3.0,35,0.08571428571428572,positive
must be the water,0,4,0.0,neutral
The way everyone had to act surprised when Nintendo dropped this,0,11,0.0,neutral
Next one finna Pokémon Whip and Nae Nae,0,8,0.0,neutral
After ZA I’m kinda worried,0,5,0.0,neutral
"We want ASH <span class=""ytAttributedStringInlineBlockMod"" style=""margin-left: 2px; margin-right: 2px;""><img alt=""😢"" class=""ytCoreImageHost ytAttributedStringImageElement ytAttributedStringImageAlignmentVerticalCenter ytCoreImageContentModeScaleToFill ytCoreImageLoaded"" style=""height: 16px; width: 16px;"" src=""./winds_files/emoji_u1f622.png"">",0,4,0.0,neutral
Only on switch 2 ? ...,0,6,0.0,neutral
Someone else tell me they see Chelsea from Craig of the Creek in Browt XD,0,15,0.0,neutral
Pokémon WiWa,0,2,0.0,neutral
In my remains...,0,3,0.0,neutral
A lendária 10 geração,0,4,0.0,neutral
Looks like Pokémon snap,1.0,4,0.25,positive
Please DO NOT make the fire starter stand on 2 legs this time!,0,12,0.0,neutral
i just want more pokemon resort.,0,6,0.0,neutral
love pokemon games from 5 not easy and very addictives games game boy advance is big but this new ones omg,1.0,20,0.05,positive
"I really hope they finally include voice acting into the game! The whole ""textboxes"" they've been using is getting really old, especially for a hybrid console like the Switch and Switch 2! But sadly, I suppose for tradition, they're just always gonna be stuck like that... <span class=""ytAttributedStringInlineBlockMod"" style=""margin-left: 2px; margin-right: 2px;""><img alt=""😞"" class=""ytCoreImageHost ytAttributedStringImageElement ytAttributedStringImageAlignmentVerticalCenter ytCoreImageContentModeScaleToFill ytCoreImageLoaded"" style=""height: 16px; width: 16px;"" src=""./winds_files/emoji_u1f61e.png"">",0.5,47,0.010638297872340425,positive
I need that scrap song like asap. Come on Nintendo music help me out!,1.0,14,0.07142857142857142,positive
yeah they’re running on fumes at this point.,0,8,0.0,neutral
"That look so much better then the last games. And most of the pokemon look like pokemons....<span class=""ytAttributedStringInlineBlockMod"" style=""margin-left: 2px; margin-right: 2px;""><img alt=""🎉"" class=""ytCoreImageHost ytAttributedStringImageElement ytAttributedStringImageAlignmentVerticalCenter ytCoreImageContentModeScaleToFill ytCoreImageLoaded"" style=""height: 16px; width: 16px;"" src=""./winds_files/emoji_u1f389.png"">",1.0,17,0.058823529411764705,positive
i bet theres still no voiceover :D,-1.0,7,-0.14285714285714285,negative
So i guess we ain't never getting a bronze or copper versions but either way should be fun,0.0,18,0.0,neutral
lowkey hopes arent high but lets see what they cooked,0,10,0.0,neutral
"Luminous city <span class=""ytAttributedStringInlineBlockMod"" style=""margin-left: 2px; margin-right: 2px;""><img alt=""😊"" class=""ytCoreImageHost ytAttributedStringImageElement ytAttributedStringImageAlignmentVerticalCenter ytCoreImageContentModeScaleToFill ytCoreImageLoaded"" style=""height: 16px; width: 16px;"" src=""./winds_files/emoji_u1f60a.png"">",0,3,0.0,neutral
No more slice of cheese on the fire-type eh?,-1.0,9,-0.1111111111111111,negative
the cold dead eyes of the pikachu in a dress will haunt me in my nightmares,0,16,0.0,neutral
"Pokémon Nami and Pokémon Kaze. Is the protagonist named Minato? <span class=""ytAttributedStringInlineBlockMod"" style=""margin-left: 2px; margin-right: 2px;""><img alt=""😅"" class=""ytCoreImageHost ytAttributedStringImageElement ytAttributedStringImageAlignmentVerticalCenter ytCoreImageContentModeScaleToFill ytCoreImageLoaded"" style=""height: 16px; width: 16px;"" src=""./winds_files/emoji_u1f605.png"">",0,11,0.0,neutral
"I’m so excited for this “too much water” and jungle experience, we barely had any jungle experience like this right?This is Hoenn + Alola but bigger right?!Really have high hopes.I’m already loving the look.The protagonist look amazing!!The starters too!!!The huge place that seems like a resort is reminding me of Phenac City and the Realgam Tower from Orre Region from Pokémon Colosseum and XD Gale of Darkness.I’m already hearing the themes!!",0.5,71,0.007042253521126761,positive
"Whatever you do you won't be able to beat clair obscure <span class=""ytAttributedStringInlineBlockMod"" style=""margin-left: 2px; margin-right: 2px;""><img alt=""😂"" class=""ytCoreImageHost ytAttributedStringImageElement ytAttributedStringImageAlignmentVerticalCenter ytCoreImageContentModeScaleToFill ytCoreImageLoaded"" style=""height: 16px; width: 16px;"" src=""./winds_files/emoji_u1f602.png"">",0,12,0.0,neutral
Now put this level of attention and detail into the games we spend 70 dollars on,0,16,0.0,neutral
Oh this aint running on swich 1. Niw where is Emmet?!,0,11,0.0,neutral
O Pokémon mais raro de todos os tempos é o Pokémon Missingno você tem que pegar todos,0,17,0.0,neutral
"As a retired pokémaniac, I find myself wishing these came out years earlier. They look so beautiful.",0,17,0.0,neutral
I pray very badly that this game has an interesting story similar to Platinum or Emerald. Please Please Please keep doing your thing but make the game iconic like they used to be. I know we all remember that feeling of walking through the electronics sections and seeing Leaf Green &amp; Fire Red before the glass case just waiting on the day it was your turn to own a copy for your GameBoy/DSi… this is the chance to do it right. No brain rot. No money grubbing. Just pure enjoyment and experience,-0.5,92,-0.005434782608695652,negative
"So what I gather from the name, this is just a theory, is the legendary Pokemon in winds will be a flying type and waves will be a water type.",0,30,0.0,neutral
i fell like pokémon legend z-a have 4 months old,1.0,10,0.1,positive
Looks a lot better than Z-A,0,6,0.0,neutral
"<span class=""ytAttributedStringInlineBlockMod"" style=""margin-left: 2px; margin-right: 2px;""><img alt=""🤔"" class=""ytCoreImageHost ytAttributedStringImageElement ytAttributedStringImageAlignmentVerticalCenter ytCoreImageContentModeScaleToFill ytCoreImageLoaded"" style=""height: 16px; width: 16px;"" src=""./winds_files/emoji_u1f914.png"">",0,1,0.0,neutral
Browt: Don't forget to do your daily 15 minutes language learning lesson,0,12,0.0,neutral
I just want to know if it’s traditional battle style -,0,11,0.0,neutral
Time to whip out those balls..one last time.,0,8,0.0,neutral
"Glad the graphics finally caught up to the standard of 10 years ago. Well, I hope they'll let us actually fly on our pokemon in the base game this time.",1.0,30,0.03333333333333333,positive
I’m 32 years old and I’m smiling like I did when x and Y came out  ohhhh yes,2.0,18,0.1111111111111111,positive
Gecqua (i hope i spelled that write) is giving me shades of intleon and drizzle not squabble though he really looked different even to drizzle,0,24,0.0,neutral
"Looking nice as a first trailer definitely, pls just dont make the starters weird or ugly like they've been recently<span class=""ytAttributedStringInlineBlockMod"" style=""margin-left: 2px; margin-right: 2px;""><img alt=""🥺"" class=""ytCoreImageHost ytAttributedStringImageElement ytAttributedStringImageAlignmentVerticalCenter ytCoreImageContentModeScaleToFill ytCoreImageLoaded"" style=""height: 16px; width: 16px;"" src=""./winds_files/emoji_u1f97a.png"">",1.0,20,0.05,positive
"This game really makes you feel like Pokemon <span class=""ytAttributedStringInlineBlockMod"" style=""margin-left: 2px; margin-right: 2px;""><img alt=""😂"" class=""ytCoreImageHost ytAttributedStringImageElement ytAttributedStringImageAlignmentVerticalCenter ytCoreImageContentModeScaleToFill ytCoreImageLoaded"" style=""height: 16px; width: 16px;"" src=""./winds_files/emoji_u1f602.png"">",1.0,9,0.1111111111111111,positive
Browt is just Red in green color,0,7,0.0,neutral
All I want is that the rival is an actual rival &amp; the antagonists are menacing. Not no bullies or misunderstood rockers,0,21,0.0,neutral
Why you guys making copyrights for things you didn't make and suing people?,0,13,0.0,neutral
Watch this game gets a 7.0 due to...TOO MUCH WIND!,0,10,0.0,neutral
"Pleeeaase pokemon make Pombon a Fire Fairy for its final evo. Itd be the first one and would fit it super well <span class=""ytAttributedStringInlineBlockMod"" style=""margin-left: 2px; margin-right: 2px;""><img alt=""😭"" class=""ytCoreImageHost ytAttributedStringImageElement ytAttributedStringImageAlignmentVerticalCenter ytCoreImageContentModeScaleToFill ytCoreImageLoaded"" style=""height: 16px; width: 16px;"" src=""./winds_files/emoji_u1f62d.png"">",0,23,0.0,neutral
This game actually looks like it's from this generation. Still need to see gameplay though.,0.0,15,0.0,neutral
"ah, its like the Pokemon Shield Legendary... only orange...",1.0,9,0.1111111111111111,positive
indonesia land reference here we go,0,6,0.0,neutral
"Do y'all think this looks pretty similar to fula city <span class=""ytAttributedStringInlineBlockMod"" style=""margin-left: 2px; margin-right: 2px;""><img alt=""👀"" class=""ytCoreImageHost ytAttributedStringImageElement ytAttributedStringImageAlignmentVerticalCenter ytCoreImageContentModeScaleToFill ytCoreImageLoaded"" style=""height: 16px; width: 16px;"" src=""./winds_files/emoji_u1f440.png"">",0,11,0.0,neutral
Looks good! Can't wait! I hope the human characters have their own unique voices and actually talk during major conversation scenes and cut scenes instead of just watching their mouths move and reading the words that they are supposed to be saying. That would give them so much more life and energy with the right amount of energy from voice actors.,1.0,61,0.01639344262295082,positive
"We want ash back <span class=""ytAttributedStringInlineBlockMod"" style=""margin-left: 2px; margin-right: 2px;""><img alt=""😢"" class=""ytCoreImageHost ytAttributedStringImageElement ytAttributedStringImageAlignmentVerticalCenter ytCoreImageContentModeScaleToFill ytCoreImageLoaded"" style=""height: 16px; width: 16px;"" src=""./winds_files/emoji_u1f622.png"">",0,5,0.0,neutral
So can the character be customized by the player?,0,9,0.0,neutral
